<!ELEMENT placas (placa*)>
<!ELEMENT placa (microprocesador, memoria+, modelo, fabricante)>
<!ELEMENT microprocesador (#PCDATA)>
<!ELEMENT memoria (#PCDATA)>
<!ELEMENT modelo (#PCDATA)>
<!ELEMENT fabricante (asus | intel)>
<!ELEMENT asus EMPTY>
<!ELEMENT intel EMPTY>